id,date,time,daypart,name,company,location,isInviteOnly,topics,formats,description,externalHref
96,2026-06-03,18:00:00,evening,AI Engineers: Live Podcast,Fonzi AI,Brooklyn,False,AI / Agents / GenAI,other,,https://partiful.com/e/pGL0NLh3yPk5sZHlDatO
139,2026-06-03,18:00:00,evening,Tech Week for Transatlantic Builders,Frenchfounders,Flatiron,True,Founder fundraising / VC,technical_talk_workshop,,
199,2026-06-03,18:00:00,evening,AI-assisted setups featuring Activant & Stuut,Stuut,SoHo,False,AI / Agents / GenAI;Consumer / creative / media,technical_talk_workshop;community_networking,We're hosting a happy hour for builders to discuss how they using AI to build. From claude to openclaw. We're sharing best practices and how people cook up…,https://partiful.com/e/ELpOGky1e3EphdQfLUHC
203,2026-06-03,18:00:00,evening,PHL vs NYC Founder Draft,localhost:nyc,Midtown,False,Founder fundraising / VC,other,,https://partiful.com/e/vMnZZEd9ek0rQ09zFpeE?c=vGTiWmcq
244,2026-06-03,18:00:00,evening,The New Financial Internet: NY Tech Week Mixer,Rayo Capital,SoHo,True,AI infra / devtools / cloud;Founder fundraising / VC,technical_talk_workshop;community_networking;fundraising_vc,,
3996,2026-06-03,18:00:00,evening,Modus Digital Salon: Helping Humans Choose,Modus Digital,Hudson Yards,False,Consumer / creative / media,technical_talk_workshop;community_networking,"Modus Salons are intimate, invite-only dinner events designed to gather senior leaders to network, learn about industry trends, and build community in this…",https://partiful.com/e/ph7PbMda2wCCpzRmLh1H
4071,2026-06-03,18:00:00,evening,Darkside AI Rooftop Soiree,Darkside AI,Financial District,False,AI / Agents / GenAI;AI infra / devtools / cloud;Founder fundraising / VC;Consumer / creative / media,technical_talk_workshop;fundraising_vc,"🍸An exclusive evening above the city on a private Wall Street rooftop. A discreet gathering of investors, executives and tech leaders shaping the future o…",https://partiful.com/e/7JfEW6CdsbhpkYOQkKBP
4087,2026-06-03,18:00:00,evening,New York | HappyRobot Builders Night,HappyRobot,SoHo,True,Climate / deeptech / hardware,technical_talk_workshop,,
4088,2026-06-03,18:00:00,evening,How Chiefs of Staff Build Knowledge Systems That Scale,Ask a Chief of Staff,SoHo,False,other,technical_talk_workshop,,https://partiful.com/e/2NKa5VcOrPj4F2oHrsZ9
4110,2026-06-03,18:00:00,evening,Ramp x Litquidity Padel Club,Palm & Park,Brooklyn,False,Consumer / creative / media,community_networking,​Litquidity and Ramp are joining forces to start an exclusive padel club - a series of Miami and New York based padel socials and tournaments for the indus…,https://partiful.com/e/IUjmw9zV593m1Df36kKR
4142,2026-06-03,18:00:00,evening,The Future of Hoops: Elevating The Game,Andiem,Union Square,True,other,other,,
4186,2026-06-03,18:00:00,evening,Connect on Your Level,LEVEL™,West Village,False,other,other,,https://partiful.com/e/GNv7CypZevOpJN6ol6Jk
4407,2026-06-03,18:00:00,evening,Is Software the New Fast Fashion,Alternew,Flatiron,False,Consumer / creative / media,other,,https://partiful.com/e/4iLm6df7Ix4OxkTWsJ5m
4422,2026-06-03,18:00:00,evening,Ugly Talk: The Future of Beauty Tech,Ugly Talk,SoHo,False,Health / bio / wellness,other,,https://partiful.com/e/68VP2zOWWMpKd3gZsojI
4466,2026-06-03,18:00:00,evening,From Legislation to Action: Shaping the Future of Privacy in New York,Woodhull Freedom Foundation,Greenwich Village,False,AI infra / devtools / cloud;Consumer / creative / media,technical_talk_workshop;product_demo_showcase,Privacy isn’t abstract for LGBTQ+ people. It’s often the difference between safety and exposure. In a world where our lives are increasingly lived online a…,https://partiful.com/e/ndxAl17PlEmXU25KpLzy?c=y7xdvBtU
4481,2026-06-03,18:00:00,evening,Secret Garden Party,Entre,Lower East Side,False,Consumer / creative / media,community_networking,,https://partiful.com/e/YtPpBkhAuVR9Wsm6UfoE
4489,2026-06-03,18:00:00,evening,The Ultimate Marketing Trivia Night!,Wistia,West Village,False,AI infra / devtools / cloud;GTM / marketing / creator;Consumer / creative / media,community_networking,Get ready to flex your brand brilliance and data-driven wit at the most high-stakes happy hour of Boston Tech Week. Join a room full of the city’s sharpest…,https://partiful.com/e/8SXCfTdKIADQfNVRTvDH
4539,2026-06-03,18:00:00,evening,AI Game Dev Mini- Hackathon (by Vevey!),Vevey,Flatiron,False,AI / Agents / GenAI,technical_talk_workshop,"Come build your own video game from scratch in just one afternoon! Using Vevey's AI-powered platform, you will go from idea to fully playable game in a few…",https://partiful.com/e/mlTKGO4ougVZjKKQNAJk
4546,2026-06-03,18:00:00,evening,What AI Can't Fix Yet Happy Hour,Somnio Software,SoHo,False,AI / Agents / GenAI;Founder fundraising / VC;Consumer / creative / media,community_networking;fundraising_vc,This event is a part of #NY TechWeek—a week of events hosted by VCs and startups to bring together the tech ecosystem. Learn more at www.tech-week.com,https://partiful.com/e/rsCEzQaaJQJ2gbgdNrvP
4591,2026-06-03,18:00:00,evening,The Architecture of Scale: An Executive Dinner for Engineering Leaders | NYC Tech Week,Infobip,Greenwich Village,True,Consumer / creative / media,technical_talk_workshop;community_networking,,
4610,2026-06-03,18:00:00,evening,Healthtech Social by Scalpels & Spreadsheets,KLI Capital,Midtown,False,AI infra / devtools / cloud;Founder fundraising / VC;Health / bio / wellness,technical_talk_workshop;community_networking;fundraising_vc,,https://partiful.com/e/jb36hgCBsjw6Ej7QA1vM
4612,2026-06-03,18:00:00,evening,AI-Powered Customer Success: From Strategy to Execution,Latinos in Success,Greenwich Village,False,AI / Agents / GenAI;Consumer / creative / media;Diversity / women / international,technical_talk_workshop,Explore how leading CS teams are moving beyond AI experimentation to real-world impact. This workshop will unpack how to strategically integrate AI across …,https://partiful.com/e/dkcPj9zlgegjOS4bDeCd
4664,2026-06-03,18:00:00,evening,MCP in the Wild: Panel & Night of Networking,MCP Manager by Usercentrics,East Village,False,Consumer / creative / media,community_networking,"Join us for an evening of networking and discussion with leaders in the MCP ecosystem. ""MCP in the Wild"" is part of #NewYorkTechWeek and includes panelists…",https://partiful.com/events/6ZuudQBBZXcMNjdMynJ2
4678,2026-06-03,18:00:00,evening,Cyberthreats in the AI era,How2Scale,Midtown,False,AI / Agents / GenAI;AI infra / devtools / cloud,other,,https://partiful.com/e/Y4qVEuhXoPZo3xGIptiA
4719,2026-06-03,18:00:00,evening,Agent Harnesses: What It Takes to Make AI Agents Work in the Enterprise,STELLANS.io,Union Square,False,AI / Agents / GenAI;Consumer / creative / media,other,,https://partiful.com/e/2NP0rZW8BmdGAGUOEhGP?f=1
4746,2026-06-03,18:00:00,evening,Chief of Staff Dinner,Valon,Flatiron,True,other,community_networking,,
4766,2026-06-03,18:00:00,evening,Scale AI | Human in the Loop LIVE,Scale AI,Chelsea,False,AI / Agents / GenAI,other,,https://partiful.com/e/ddUgaIgdAlkIM2AlSWDk
4779,2026-06-03,18:00:00,evening,The Art of Building & the Art of the Table,Arnold & Porter,SoHo,True,Consumer / creative / media,technical_talk_workshop,,
4785,2026-06-03,18:00:00,evening,Trusted Table,Eclypsium,Financial District,True,other,other,,
4787,2026-06-03,18:00:00,evening,The Art of Building & the Art of the Table,Arnold & Porter,SoHo,True,Consumer / creative / media,technical_talk_workshop,,
4806,2026-06-03,18:00:00,evening,AI for Alt Asset,V7,Financial District,True,AI / Agents / GenAI,other,,
4813,2026-06-03,18:00:00,evening,Recharge & Connect,DealMaker,Flatiron,False,Founder fundraising / VC;Consumer / creative / media,technical_talk_workshop,"DealMaker is taking over Othership for the night. Founders, operators, builders, good drinks, and real conversation. Come meet the people you've been meani…",https://partiful.com/e/07FeLmQ6hrIDF1HKSM3U
4824,2026-06-03,18:00:00,evening,Unlocked Foundation Tech Week Money Talk,The Unlocked Foundation,Meatpacking District,True,other,other,,
4831,2026-06-03,18:00:00,evening,New Vital Order: AI & Health Mixer,Fusion Fund,Midtown,False,AI / Agents / GenAI;AI infra / devtools / cloud;Founder fundraising / VC;Health / bio / wellness;Consumer / creative / media,technical_talk_workshop;community_networking;fundraising_vc,"Join Fusion Fund, Primary Venture Partners, and Flare Capital Partners for an exclusive evening of cocktails and high-caliber networking as we dig deep int…",https://partiful.com/e/Ho9Hvhtn5iU4ws7IWM8Z
4857,2026-06-03,18:00:00,evening,The Scaling Gap,Women in AI,Flatiron,False,AI / Agents / GenAI;Diversity / women / international,other,,https://partiful.com/e/Vg3uhwlG7t6HdALQeYTm?c=NY9lRtlj
4884,2026-06-03,18:00:00,evening,NYC Tech Week Town Hall,BitBasel,SoHo,False,other,other,,https://partiful.com/e/6taIcgNN8nelcYyF4QXx
4896,2026-06-03,18:00:00,evening,The Neural Network Mixer,Epiphany,SoHo,False,Founder fundraising / VC;Consumer / creative / media;Climate / deeptech / hardware,community_networking;fundraising_vc,"This event is a fireside chat + mixer for a curated room of founders, researchers, physicians, and angel investors in the neurotech space to gather to exch…",https://partiful.com/e/YMW6sYTh9iRAZZnDCycn
4901,2026-06-03,18:00:00,evening,"Off the Record: AI, Liability & What’s Actually Coming ️",XL AI,East Village,False,AI / Agents / GenAI,other,,https://partiful.com/e/S6Qa7oltBDN0RiFeWCP6
4917,2026-06-03,18:00:00,evening,The Experience Layer - Virtual Reality Happy Hour,VR/AR Association,Financial District,False,Founder fundraising / VC;Consumer / creative / media,community_networking;fundraising_vc,This event is a part of #NYTechWeek—a week of events hosted by VCs and startups to bring together the tech ecosystem. Learn more at www.tech-week.com.,https://partiful.com/e/adlwN5cRTmxsFIy8TL5v
4939,2026-06-03,18:00:00,evening,Style Your Tech - Customise Your Cyberdeck,Hybrid Rituals,Midtown,False,AI infra / devtools / cloud,other,,https://partiful.com/e/F9b11DvXSlOLRhvyp35Q?source=share&c=NDpP89Ir
4965,2026-06-03,18:00:00,evening,Slovak Startup Pitch Night,SOSA,Upper East Side,False,Founder fundraising / VC;GTM / marketing / creator;Consumer / creative / media,fundraising_vc,"Join us for Slovak Startup Pitch Night during NY Tech Week, an evening featuring a handpicked group of high-growth startups from Slovakia as they enter and…",https://partiful.com/e/Igsl0PM9f4966lvt7uPc
4977,2026-06-03,18:00:00,evening,"Screened Out - AI broke hiring, what now?",Our Wave,Flatiron,False,AI / Agents / GenAI;Founder fundraising / VC,technical_talk_workshop,"AI is rewriting work, creativity, and culture. The founders who understand that will build the companies that define the next decade. This is where that co…",https://partiful.com/e/StGbEbPNPYy51qRWwquT?c=Hz_mXqWN
5009,2026-06-03,18:00:00,evening,Podcast & Beauty Night at Tech Week,The Ok Sweetie Show,SoHo,False,AI / Agents / GenAI;Founder fundraising / VC;Health / bio / wellness,other,"Join The Ok Sweetie Show and True Beauty Ventures for an intimate evening at Tech Week. Founders, LP, and powerhouses coming together for cocktails, commun…",https://partiful.com/e/Zpug1scEnob8QlWGmoK9
5022,2026-06-03,18:00:00,evening,Bioadapting: AI & the Future of Live Performance,Bioadapting,Nomad,True,AI / Agents / GenAI;Health / bio / wellness,other,,
5028,2026-06-03,18:00:00,evening,"The Edit: A Curated Evening of Food, Fashion & AI",athena studio,Tribeca,True,AI / Agents / GenAI;Consumer / creative / media,other,,
5033,2026-06-03,18:00:00,evening,Clair Health: After Hours,Clair Health,Flatiron,False,AI / Agents / GenAI;Health / bio / wellness;Diversity / women / international,community_networking,"Clair Health, the first non-invasive, continuous hormone monitor for women, is hosting a community-driven gathering during #NYTechWeek — designed as an oas…",https://partiful.com/e/8j2aEOaE2GIi1b08Kw5m
5034,2026-06-03,18:00:00,evening,Startup Soirée,Cleo Pay,Chelsea,False,Consumer / creative / media,other,,https://partiful.com/e/Odap0FUTDOZzOfLXTe6k
5042,2026-06-03,18:00:00,evening,Beauty Tech | New York Tech Week,Yorkseed,Lower East Side,False,Founder fundraising / VC;Health / bio / wellness,fundraising_vc,,https://partiful.com/e/a9EqqL10lCAUh5UUPiJ9
5049,2026-06-03,18:00:00,evening,AI Value Creation & The AI Operating Model,StartOut,Midtown,False,AI / Agents / GenAI;Founder fundraising / VC;Consumer / creative / media,fundraising_vc,"StartOut NYC and Out in Tech NYC present 'Investors and Operators Roundtable: The Disruptive AI Operating Model', a private, invite-only roundtable, bringi…",https://partiful.com/e/zZNGc5V5hVR8uBY2OA0j?c=23fT06JC
5101,2026-06-03,18:00:00,evening,The Tech Table with Moov and Appian,Moov,Tribeca,True,other,other,,
5129,2026-06-03,18:00:00,evening,Behind the Check: An Unfiltered Conversation with Angel Investors,Brown Girl Angels,Midtown,True,Founder fundraising / VC,fundraising_vc,,
5138,2026-06-03,18:00:00,evening,Creative Systems Happy Hour: AI for Commercial-Grade Design,Virse Labs,Flatiron,False,AI / Agents / GenAI,technical_talk_workshop;community_networking,,https://partiful.com/e/CVDYwREXwTGlAxsek3BM
5163,2026-06-03,18:00:00,evening,Ramp x 8VC — Founders & Builders Night,Ramp,Flatiron,False,Founder fundraising / VC,technical_talk_workshop;fundraising_vc,,https://partiful.com/e/xf4L0OHJO6UHVVu3GKNN
5169,2026-06-03,18:00:00,evening,Bookkeeping and Bourbon: Rooftop Cocktails + Founder Panel,Wiss,Midtown,False,AI / Agents / GenAI;Founder fundraising / VC,other,,https://partiful.com/e/D7mgFNgIr2icwr0JJvvI
5218,2026-06-03,18:00:00,evening,Who Benefits from AGI Abundance,Savas Labs,SoHo,False,AI / Agents / GenAI;Fintech / finance,technical_talk_workshop,AI is creating wealth faster than any technology in history — and concentrating it in fewer hands. This is a curated conversation about what fulfilling liv…,https://partiful.com/e/gIK9Dj3aDPsfHwISpKSd
5226,2026-06-03,18:00:00,evening,Coding Agents Write Code.  Remy Builds Products.,MindStudio,Flatiron,False,AI / Agents / GenAI,technical_talk_workshop;product_demo_showcase,,https://partiful.com/e/svhgMRybAh1XPlLVVXRH
5237,2026-06-03,18:00:00,evening,AI x The Future of Work,HuCapital,Upper Manhattan,False,AI / Agents / GenAI;AI infra / devtools / cloud;Founder fundraising / VC,technical_talk_workshop;fundraising_vc,,https://partiful.com/e/KTWA41kbFNYFFtf6HcG7
5264,2026-06-03,18:00:00,evening,The Accelerator Table,AcceleratorCON,Chelsea,False,other,other,,https://partiful.com/e/DY6XJUWM6H39sVyu4Ize
5316,2026-06-03,18:00:00,evening,LinkedIn GTM Hackathon,GenZtea,Flatiron,False,GTM / marketing / creator,technical_talk_workshop,,https://partiful.com/e/EdiAncVfz5Pwyx8ljgDR
5333,2026-06-03,18:00:00,evening,The Rise Circle: After Hours,African Women in STEM,Midtown,False,Diversity / women / international,other,,https://partiful.com/e/64Fzm7ItTZKGiWI419L2?c=MpqCABzS
5340,2026-06-03,18:00:00,evening,Did AdTech move on? the layer needed for Agentic Era,Foundation for Agentic Networks,Midtown,False,AI / Agents / GenAI,other,,https://partiful.com/e/NLYATZ2b1ZaihIuIQGUF
5349,2026-06-03,18:00:00,evening,The Future of Travel: Meet Investors and Founders,Jetzy,Midtown,False,Founder fundraising / VC,fundraising_vc,,https://partiful.com/e/vMgh1HOU0xqBmBJdxwCI
5391,2026-06-03,18:00:00,evening,Global Founder Meetup: Breaking Into the U.S. Market,Build Momentum,Financial District,False,Founder fundraising / VC;Consumer / creative / media;Diversity / women / international,technical_talk_workshop;community_networking,,https://partiful.com/e/6rbvin19cnCqiv6pRd3v
5414,2026-06-03,18:00:00,evening,Series Tee,Rillet,Chelsea,False,other,other,NYC Tech Week has no shortage of events. Series Tee is something different. Rillet is hosting an exclusive day of golf at Chelsea Piers — right on the Huds…,https://partiful.com/e/Ec1a7gzI7aTu6njnKuEK?c=M7AzYqJW
5430,2026-06-03,18:00:00,evening,Build Mode: How RevOps & GTM Teams Are Becoming AI-Powered Builders,HubSpot,SoHo,False,AI / Agents / GenAI;AI infra / devtools / cloud;GTM / marketing / creator;Consumer / creative / media,technical_talk_workshop,"SaaS is changing — the line between operators and developers is blurring, and RevOps, GTM, and ops teams are leading the charge. At Build Mode, HubSpot is …",https://partiful.com/events/o1qradCjiAlnUg3c6ZWj
5458,2026-06-03,18:00:00,evening,The Hidden Cost of the Luteal Phase: Why High-Performing Women Lose Burn Out Every Month,Pinkmatter,Flatiron,False,AI / Agents / GenAI;Consumer / creative / media;Diversity / women / international,wellness_social,"Most high-performing women have learned to work around it. The two weeks of brain fog, mood dysregulation, fatigue, and physical symptoms that arrive every…",https://partiful.com/e/rHJGm9ykUTSOWQawYe68
5680,2026-06-03,18:00:00,evening,"Trust, Talent & AI in the Enterprise",Unlocked Consultancy,Upper Manhattan,False,AI / Agents / GenAI;Consumer / creative / media,other,"AI is fast changing how we work - team structures, leadership, performance, recruitment and more. Some organizations can't keep up, or know where to start.…",https://partiful.com/events/r9eck0K6ZWexRHMzjGNV
5821,2026-06-03,18:00:00,evening,Unicorn fintech founder AMA,Inkle,SoHo,False,Founder fundraising / VC;Fintech / finance,other,,https://partiful.com/e/fOUJT07jj19qFk04dt8E
5830,2026-06-03,18:00:00,evening,Dinner with Rehearsals,Rehearsals,SoHo,True,Consumer / creative / media,community_networking,,
5837,2026-06-03,18:00:00,evening,Fashion Tech Mixer,The Pattern Maker,Chelsea,False,Consumer / creative / media,community_networking,,https://partiful.com/e/27uya3lZ0qDGkfCiXGP5
5847,2026-06-03,18:00:00,evening,Can Your Brand Thrive in Agentic Commerce?,UpScaleX,Midtown,False,AI / Agents / GenAI;GTM / marketing / creator,other,,https://partiful.com/e/2cw8oY83GlBtW74X1B3x?c=UNmoZVNV
5863,2026-06-03,18:00:00,evening,Queens Founders & Investors Dinner,Enpak,Queens,False,Founder fundraising / VC;Consumer / creative / media,community_networking;fundraising_vc,"An intimate, curated dinner bringing together a select group of founders and investors from Queens, NY, for meaningful conversations, shared insights, and …",https://partiful.com/e/0D0CXzkR1otSnvSekJh4
5866,2026-06-03,18:00:00,evening,No Wine Left Behind: Blind Tasting Meets Consumer Data,No Wine Left Behind,West Village,False,AI infra / devtools / cloud;Consumer / creative / media,other,,https://partiful.com/e/1fVvsQZUFf7Dohot0Ed9?c=tfyZLHXu
5873,2026-06-03,18:00:00,evening,Is Your Brand Ready for AI Search?,Capgemini,Union Square,False,AI / Agents / GenAI;GTM / marketing / creator;Consumer / creative / media,other,,https://partiful.com/e/v9ySMNeHZ3lYMWjhvqCO?
5874,2026-06-03,18:00:00,evening,Scaling Value-Based Care in the Age of Health Tech,Columbia Venture Community,Midtown,False,AI infra / devtools / cloud;Health / bio / wellness;Consumer / creative / media,technical_talk_workshop;community_networking,Join us for a dynamic panel discussion on how healthcare is evolving in today’s rapidly advancing health tech landscape. As the industry continues to shift…,https://partiful.com/e/6FmuBjS60nrpePXnGWhC?c=DazpYrUx
5879,2026-06-03,18:00:00,evening,Ugly Talk: Can Your Brand Thrive in Agentic Commerce?,Ugly Talk,Midtown,False,AI / Agents / GenAI;GTM / marketing / creator,other,,https://partiful.com/e/G1Rqksr7pQb3T5sGRCPp
5883,2026-06-03,18:00:00,evening,Translate Your BA into an In-Demand Tech Career,Translating Your BA,Virtual (NYC),False,Consumer / creative / media,other,,https://partiful.com/e/8BbHXWQWQwaQnAUlrwur
5887,2026-06-03,18:00:00,evening,AI builders night,Braintrust,East Village,False,AI / Agents / GenAI,technical_talk_workshop,,https://partiful.com/e/OeZ0CvpvEpvi9lrEYIeb?c=PzNLPo4j
6198,2026-06-03,18:00:00,evening,Pitch Roast Live,Pitch Roast Live,Lower East Side,False,Founder fundraising / VC,fundraising_vc,,https://partiful.com/e/NhoyBpx8rlyJGJXOWbwG
21,2026-06-03,18:30:00,evening,Rooftop Pickleball with Conquer,Conquer Pickleball,Midtown,False,other,other,,https://partiful.com/e/fOtMgCgM7Ihp9IIYOVgN
4038,2026-06-03,18:30:00,evening,Women in Tech Happy Hour/ Networking,Products by Women,Chelsea,False,Diversity / women / international,product_demo_showcase;community_networking,,https://partiful.com/e/Ku3dnK0jFElueDqn5oba?f=1
4148,2026-06-03,18:30:00,evening,Asian women product design leader dinner,Koi Studios,Flatiron,False,Diversity / women / international,product_demo_showcase;community_networking,,https://partiful.com/e/0LzOTdMr0JBCzNfr1jKz?c=wx-ZI2vA
4171,2026-06-03,18:30:00,evening,Stop Guessing: How Top Teams Make Hiring Decisions,Pairwise,Virtual (NYC),False,AI / Agents / GenAI,other,,https://partiful.com/e/zgdltkCVCJs9VWdjnxpX?c=nas4DXsK
4188,2026-06-03,18:30:00,evening,South Asians in Finance,American South Asian Network,Midtown,False,Fintech / finance;Diversity / women / international,other,"South Asians in Finance brings together South Asian leaders across finance, fintech, investing, and adjacent sectors for a focused, high-signal conversatio…",https://partiful.com/e/MFfmDRWvhSBTDNsj9Koj
4195,2026-06-03,18:30:00,evening,MIT VC Investor Dinner,a16z speedrun,SoHo,True,Founder fundraising / VC,community_networking;fundraising_vc;wellness_social,,
4348,2026-06-03,18:30:00,evening,Investor Dinner,Brderless,West Village,False,AI / Agents / GenAI;Founder fundraising / VC,community_networking;fundraising_vc,"A special evening with a curated group of active VCs for honest conversation, a three-course dinner, and sommelier-paired wines at one of New York City's m…",https://partiful.com/e/CXgpxdHdQQ3umurfwb2Y
4402,2026-06-03,18:30:00,evening,Gammarama: Stories You Can See,Gamma,Midtown,False,Consumer / creative / media,community_networking,Welcome to the boldest show of NY Tech Week 2026. Come for the biggest names in tech. Stay for the stories you didn't see coming (and the party to follow).…,https://partiful.com/e/fCEfTvswCDe1lJYqLHQv
4434,2026-06-03,18:30:00,evening,AI Playbooks for Finance Leaders,DualEntry,Flatiron,False,AI / Agents / GenAI;Fintech / finance,other,,https://partiful.com/e/menYiNujMph20V7zBugJ
4512,2026-06-03,18:30:00,evening,AgTech Leadership Dinner,Leaf Agriculture,West Village,False,other,community_networking,,https://partiful.com/e/TMkUilGT51I97Mdui4BE
4641,2026-06-03,18:30:00,evening,Where Capital Meets Vision: A Founders-Funders Dinner | NY Tech Week,Microsoft for Startups,Chelsea,True,AI infra / devtools / cloud;Founder fundraising / VC;Consumer / creative / media,technical_talk_workshop;community_networking;fundraising_vc,,
4798,2026-06-03,18:30:00,evening,LIM College THREADX TECH WEEK,"Marcuse School of Graduate Studies, LIM College",Midtown,False,Consumer / creative / media,other,,https://partiful.com/e/ggPJQCZE8juYEAjIfDgi
4931,2026-06-03,18:30:00,evening,Private CIO Dinner with Tessera Labs,Tessera Labs,Flatiron,True,other,technical_talk_workshop;community_networking,,
5002,2026-06-03,18:30:00,evening,GridMatch: A DER Mixer,Ecosuite,Union Square,False,other,community_networking,,https://partiful.com/e/Qtt9vmD7LTiKn6y1A9RL
5086,2026-06-03,18:30:00,evening,Can AI make you feel?,Slingshot AI,SoHo,False,AI / Agents / GenAI;Consumer / creative / media,product_demo_showcase,What separates a product people *love* from one they tolerate? What makes design feel human and where does AI fit into all of this without flattening the t…,https://partiful.com/e/z51AEVSzo2Ddp3np4WjW?
5121,2026-06-03,18:30:00,evening,Gnomi-When AI Makes the Trade — Who Takes the Risk?,GNOMI App Corp,SoHo,False,AI / Agents / GenAI,other,,https://partiful.com/e/hfSyqoSqdglV01JHqHue?c=58XXQtR8
5203,2026-06-03,18:30:00,evening,GP-LP Tech Week Mixer,The Kairos Circle,Midtown,True,AI / Agents / GenAI,community_networking,,
5504,2026-06-03,18:30:00,evening,How to Live Longer & Happier: An evening on the future of personal intelligence.,moccet,SoHo,False,other,other,,
5875,2026-06-03,18:30:00,evening,Learn How to Build Apps Using Lovable,SJ Innovation,Queens,True,Consumer / creative / media,technical_talk_workshop,,
6166,2026-06-03,18:30:00,evening,Built Different _ Faith in Tech,The Line,Meatpacking District,False,AI / Agents / GenAI,other,,https://partiful.com/e/jrazXyiGkUZ8d8FqotR2
6215,2026-06-03,18:30:00,evening,"Tech Week, But Bowling",Valon,Midtown,False,Consumer / creative / media,community_networking,"Create party invitations online for any event. Design custom invites in seconds, and send invites instantly with our free invitation maker!",https://partiful.com/events/URwyTSJO382HLiStFktb/edit
4095,2026-06-03,19:00:00,evening,Frontier House NYC - Favorite People Dinner,Eleven Wall Ventures,Midtown,False,other,community_networking,"Join us for the Frontier House NYC - Favorite People Dinner on Wednesday, June 3rd, from 07:00 PM to 10:00 PM for an amazing private dining experience and …",https://partiful.com/e/IdI7GpcyYOd2xnOnrn2G
4197,2026-06-03,19:00:00,evening,The Tech Leaders Suite,Insurgi Urban Concepts,Brooklyn,False,other,other,,https://partiful.com/e/UhyErPPxuo2vELIutdGj?
4366,2026-06-03,19:00:00,evening,BMO Growth & Middle Market Tech Happy Hour,BMO Tech Banking,Nomad,False,AI / Agents / GenAI;GTM / marketing / creator;Fintech / finance;Consumer / creative / media,community_networking,Step inside Ampersand — a tucked-away speakeasy near Union Square — where BMO's US Tech Banking team is hosting specialty cocktails and lite bites during N…,https://partiful.com/e/a6fwadAI0lOaKMU9r3uv
