id,date,time,daypart,name,company,location,isInviteOnly,topics,formats,description,externalHref
5123,2026-06-03,14:00:00,day_afternoon,Startup GTM — Mapping + Metrics,Pollen8,Midtown,False,Founder fundraising / VC;GTM / marketing / creator;Consumer / creative / media,technical_talk_workshop,"As part of NYC Tech Week, Pollen8 and Die-Hard are hosting a practical session designed to help founders build smarter, more precise go-to-market strategie…",https://partiful.com/e/MR78mhKL31baYtdbziHm
5159,2026-06-03,14:00:00,day_afternoon,Reimagining the value chain of life science with agentic AI,Bio Blossom Consulting,Midtown,True,AI / Agents / GenAI;Health / bio / wellness,other,,
5330,2026-06-03,14:00:00,day_afternoon,"NY Beauty Tech Summit: Future of Beauty Tech Devices, Data & Innovation",Richualist,Chelsea,False,AI infra / devtools / cloud;Health / bio / wellness,technical_talk_workshop,,https://partiful.com/e/e32DJWAieEIPVwRTAxLU?c=yvN5bfwr
5435,2026-06-03,14:00:00,day_afternoon,Best 100 Latam / Latino Startups,Colectivo,Chelsea,False,Consumer / creative / media;Diversity / women / international,other,"For the first time ever, we're mapping the 100 best early-stage startups led by Latinos — 50 from the US and 50 from Latin America — into one unified list.…",https://partiful.com/e/t4GyLlmpzMmIDjDhvSkW
5823,2026-06-03,14:00:00,day_afternoon,"The Agentic Orchestration Revolution, the new fresh approach to deploying AI Agents at scale and top security",CoralOS,Lower East Side,True,AI / Agents / GenAI;AI infra / devtools / cloud,other,,
5864,2026-06-03,14:00:00,day_afternoon,From Wall Street to Web4: Tokenization Forum,CoinBridge,Midtown,False,other,other,,https://partiful.com/e/HYTe0PKAwn3S8y6V1108
5895,2026-06-03,14:00:00,day_afternoon,Frontier House NYC - General Partner Roundtable,Eleven Wall Ventures,Midtown,False,Consumer / creative / media,other,,https://partiful.com/events/IjcQJFIYc2PPkDOy0h3r/
6207,2026-06-03,14:00:00,day_afternoon,Building agentic experiences on the frontier: Learnings from Google Antigravity,Google for Startups,Chelsea,False,AI / Agents / GenAI;Consumer / creative / media,technical_talk_workshop,"Every month brings new frontier model capabilities, agent extensibility points, standards, and more. These can often be overwhelming - what will last the t…",https://partiful.com/e/yaHOdQpASUJP8Tmts0EH
4506,2026-06-03,14:15:00,day_afternoon,Google for Developers Presents AI Learning Lab,Google,Chelsea,False,AI / Agents / GenAI;AI infra / devtools / cloud;Consumer / creative / media,technical_talk_workshop;product_demo_showcase,,https://partiful.com/e/FJbZcfppRGdMVP1o534z
4651,2026-06-03,14:30:00,day_afternoon,New York Digital HealthTech Summit 2026,Orrick,Midtown,True,Health / bio / wellness,technical_talk_workshop,,
5427,2026-06-03,14:30:00,day_afternoon,NYSE + PwC IPO Panel,PwC,Financial District,False,Consumer / creative / media,technical_talk_workshop,"PwC, in collaboration with the NYSE and JPMorgan, is hosting an invite-only executive forum for a select group of CEOs and CFOs from leading unicorn startu…",https://partiful.com/e/R9L7G8gn58zhSRtBncv7
4538,2026-06-03,15:00:00,day_afternoon,The New CEO Playbook: How to Scale Business with People & AI,42DM,Tribeca,False,AI / Agents / GenAI,other,,https://partiful.com/e/0qPzNNm0AgeHmfFyC9h2?c=h-jmMILd
4646,2026-06-03,15:00:00,day_afternoon,Mission Ready: Scaling Defense Tech,Defense Capital,Chelsea,False,AI infra / devtools / cloud;Founder fundraising / VC,technical_talk_workshop;fundraising_vc,Join industry leaders and policymakers to examine the intersection of defense technology and strategic competition. Panel discussions will address defense …,https://partiful.com/e/l79XoRaeQh6iKy77AjAz?f=1
4913,2026-06-03,15:00:00,day_afternoon,Fund Design for Mortals: A Healthtech GP/LP Salon,MarkOne Health,Tribeca,False,Founder fundraising / VC;Health / bio / wellness;Consumer / creative / media,fundraising_vc,"In an era where 84% of healthcare VC exits fall below $650M and 42% fall below $150M, the pursuit of billion-dollar ‘unicorns’ increasingly resembles a lot…",https://partiful.com/e/ktsk3lKZaqugwSxqHfO9
4959,2026-06-03,15:00:00,day_afternoon,Founder-Led Growth: The Content System That Brings Customers,Supermoon,Flatiron,False,Founder fundraising / VC;GTM / marketing / creator,community_networking,,https://partiful.com/e/FYcSnKT3uYUim41Sr7N8
5196,2026-06-03,15:00:00,day_afternoon,From Content to Course Build World Class Learning Experiences with AI,PrismLearn,Nomad,False,AI / Agents / GenAI;GTM / marketing / creator;Consumer / creative / media,technical_talk_workshop;product_demo_showcase,"Learn how to turn product knowledge into structured sales enablement and build world-class learning experiences that drive customer acquisition, improve ra…",https://partiful.com/e/1HMgJJdddcGD4CQChLYG
5199,2026-06-03,15:00:00,day_afternoon,Consumer Founder Demo Day,Flex,SoHo,False,Founder fundraising / VC;Consumer / creative / media,technical_talk_workshop;product_demo_showcase,,https://partiful.com/e/mLTDKJd37C4XRu5RTBWx
5894,2026-06-03,15:00:00,day_afternoon,Frontier House NYC Community Mixer,Eleven Wall Ventures,Midtown,False,other,community_networking,"Join us for the Frontier House NYC - Community Mixer on Wednesday, June 3rd, from 03:00 PM to 06:00 PM for notable speakers, amazing food & drink, and the …",https://partiful.com/e/pnYKgdY9IvyeGStLgEKU?f=1
5251,2026-06-03,15:15:00,day_afternoon,Memorize PI with AI,CopyCat Language,East Village,False,AI / Agents / GenAI,other,,https://partiful.com/e/MhtX7VF0KCx9iVNYduLe
5492,2026-06-03,15:15:00,day_afternoon,Fast Track to the Future: Building AI-Native Apps with Firebase and Google Cloud,Google for Startups,Chelsea,False,AI / Agents / GenAI;AI infra / devtools / cloud;Consumer / creative / media,technical_talk_workshop,"The leap from simple client-server apps to intelligent, automated workflows is the next frontier for developers. Building these high-performance, AI-driven…",https://partiful.com/e/6yRRQjBxExk25JqIoBoJ?c=hLqo5gWV
5476,2026-06-03,15:30:00,day_afternoon,Building in 3D Happy Hour,Uthana Inc,West Village,False,other,technical_talk_workshop;community_networking,,https://partiful.com/e/gf8tz8WU0NoITEo7LWGf
19,2026-06-03,16:00:00,day_afternoon,AI Agents: From Prototype to Production,Phinite AI,Flatiron,True,AI / Agents / GenAI,product_demo_showcase,,
95,2026-06-03,16:00:00,day_afternoon,How to use AI in Legal Contracts - The pitfalls and magic of the new technology,OOO a PC,Flatiron,True,AI / Agents / GenAI,other,,
149,2026-06-03,16:00:00,day_afternoon,Demo Night with The AI Collective and Atlassian,The AI Collective,Union Square,False,AI / Agents / GenAI;Consumer / creative / media,technical_talk_workshop;product_demo_showcase;community_networking,"​New York’s AI community is thriving and we’re back for another night of cutting-edge demos, real-time feedback, and quality time with some familiar faces…",https://partiful.com/e/WDfboGXhdigeIntfwsNW?c=GZExmjsB
4329,2026-06-03,16:00:00,day_afternoon,Recess at Tech Week: Throwback Field Day,Recess,West Village,False,Founder fundraising / VC;Consumer / creative / media,technical_talk_workshop;fundraising_vc,"Tech Week is here! Which means a full week of non-stop panels, pitches, and hackathons, oh my! But amidst the marathon, you're gonna need to take a real br…",https://partiful.com/e/0GFyTBq0UAi8E6N64Rlz
4358,2026-06-03,16:00:00,day_afternoon,"The 10x Moat: Valuation, Competitors, and IP Rights",ZeroToIP,Midtown,False,other,other,,https://partiful.com/e/4LCCR5kpekyh34XHD4Pu
4733,2026-06-03,16:00:00,day_afternoon,Margs & Moonshots: Swell VC’s 4th Annual AI Mixer,Swell VC,East Village,False,AI / Agents / GenAI;AI infra / devtools / cloud;Founder fundraising / VC;Consumer / creative / media,technical_talk_workshop;community_networking;fundraising_vc,"We’ve got big issues on the table where AI meets critical infrastructure, and enough oysters and margs to tackle them head-on. Swell.VC is hosting our 4th …",https://partiful.com/e/G0vIARHkSQNe1IyBX0iS
4882,2026-06-03,16:00:00,day_afternoon,Voice AI Meetup,AssemblyAI,SoHo,True,AI / Agents / GenAI,community_networking,,
5005,2026-06-03,16:00:00,day_afternoon,The Business of Christian Technology,Christians*inTech,Financial District,False,Consumer / creative / media,other,"A high-signal New York Tech Week gathering exploring the scale, legitimacy, and future of Christian technology as a market category—while spotlighting foun…",https://partiful.com/e/BDyQ9ImpqOIrqqZqmFAn?c=y4g1neCl
5239,2026-06-03,16:00:00,day_afternoon,AuthorHaus Panel: Who Owns Your Ideas in the AI Era?,Walker Media LLC,Murray Hill,False,AI / Agents / GenAI;GTM / marketing / creator;Consumer / creative / media,community_networking;wellness_social,"As technology changes how ideas are written, packaged, distributed, and remixed, ownership becomes one of the most important conversations of our time. Thi…",https://partiful.com/e/snxRe8QOXHDYcWtGhZVn
5431,2026-06-03,16:00:00,day_afternoon,Gammarama: The Pitch Party,Gamma,Midtown,False,AI / Agents / GenAI;Founder fundraising / VC;Consumer / creative / media,community_networking;fundraising_vc,"Before the party, there's the pitch party. Compete for our one wildcard spot on the Gammarama main stage — the winner will present in front of the Gammaram…",https://partiful.com/e/cDtdUampmcbyc1wqrRid
5461,2026-06-03,16:00:00,day_afternoon,Intuit Fintech Leadership Panel & Networking,Intuit,East Village,False,Fintech / finance;Consumer / creative / media,community_networking,"Join us for an intimate fireside chat and networking event with James Barrese, Senior Vice President of Fintech for Intuit Inc., as he shares his perspecti…",https://partiful.com/e/DyvtadO1TN5SrRRt3Rf5
5834,2026-06-03,16:00:00,day_afternoon,LinkedIn B2B Marketing Roundtable,LinkedIn,Financial District,False,GTM / marketing / creator;Consumer / creative / media,other,,https://partiful.com/e/TSvj1ztLBB4HbpvW9JgE
5872,2026-06-03,16:00:00,day_afternoon,Liquidity for RWA Private Credit Asset Managers,Protofire,SoHo,False,other,other,,https://partiful.com/e/05ZXMuLsZr76jJcu6T5N
5884,2026-06-03,16:00:00,day_afternoon,Union Square,AI4Purpose Inc.,Union Square,False,AI / Agents / GenAI;Consumer / creative / media,other,,https://partiful.com/e/PR649gAfDDVDcMqgGpJs
4044,2026-06-03,16:30:00,day_afternoon,C2V Initiative Year 5 Final Showcase,The C2V Initiative,Midtown,True,Consumer / creative / media,technical_talk_workshop;product_demo_showcase,,
4153,2026-06-03,16:30:00,day_afternoon,Speed Pitch,The Startup Station,Midtown,False,AI / Agents / GenAI;Founder fundraising / VC;Consumer / creative / media,fundraising_vc,"​​After the huge success at NY Tech Week' 25, AI Week NYC'25 and the recent event in March'26, Speed Pitch is back brought to you by The Startup Station, a…",https://partiful.com/e/Na47JQ1068jqK1hCbdaJ
5018,2026-06-03,16:30:00,day_afternoon,The Rise of AI-Native Marketing Systems,Genus AI,SoHo,False,AI / Agents / GenAI;AI infra / devtools / cloud;GTM / marketing / creator;Consumer / creative / media,technical_talk_workshop,"Join us during NY Tech Week for an invite-only session bringing together leaders across AI infrastructure, creative operations, and commerce to explore how…",https://partiful.com/e/WY7cbyGr92UjKOlj86tr
219,2026-06-03,17:00:00,evening,Robin Hood Foundation's Demo Day,Robin Hood Foundation,Union Square,False,Founder fundraising / VC,technical_talk_workshop;product_demo_showcase,"For the past five months, founders from the Catalyst program have been building tech solutions for economic mobility—getting funding, coaching, and mentors…",https://partiful.com/e/jAP9Qn0oS6GouCWve0Oq
4058,2026-06-03,17:00:00,evening,The Agentic Commerce Era: When AI Agents Become the New Shoppers,Glance Inmobi Inc,Midtown,False,AI / Agents / GenAI;Consumer / creative / media,other,"AI agents aren't just answering questions — they're shopping. They're browsing, comparing, and buying on behalf of consumers before a browser ever opens. T…",https://partiful.com/e/gqqUhCjTFgyxyawPSUrx
4139,2026-06-03,17:00:00,evening,The Future of Visual Commerce with AI Agents,Savanah.ai,Chelsea,False,AI / Agents / GenAI,other,,https://partiful.com/e/Sk4AHvwQJ1KaCN81CM0T?c=vKAcmyqt
4581,2026-06-03,17:00:00,evening,"Founder to Founder: AI, Ops, and Scaling in 2026",Founders Network,Financial District,False,AI / Agents / GenAI;Founder fundraising / VC,other,,https://partiful.com/e/ybvORH8ClAGkGeJpEgRd
4616,2026-06-03,17:00:00,evening,Spotlight on Scotland,Techscaler,Midtown,False,AI infra / devtools / cloud,technical_talk_workshop,What’s the latest from Scotland’s rapidly growing tech ecosystem? Join Techscaler by CodeBase [https://www.techscaler.co.uk/] for a high-impact evening of …,https://partiful.com/e/T5vXKgpmQXvgoxaFzVuR
4639,2026-06-03,17:00:00,evening,Founders & Funders Networking + Pitch,Fierce Foundry,Nomad,False,Founder fundraising / VC,community_networking;fundraising_vc,,https://partiful.com/e/9WH7EL7bJTzYq0nWA0US
4684,2026-06-03,17:00:00,evening,Founder Fireside w/ Partiful x a16z,a16z,SoHo,False,Founder fundraising / VC;Consumer / creative / media,other,,https://partiful.com/e/AQPQKes1HVxpemJcyrR8
4758,2026-06-03,17:00:00,evening,Jazz & Wine: A Night of Connections,Alt-Black,Midtown,False,Diversity / women / international,other,"End your day in the Big Apple with the perfect blend of melody, flavor, and connection. Jazz & Wine brings together wine enthusiasts, innovators, and indus…",https://partiful.com/e/AweaKcED4gNSr3LJzfCG
4764,2026-06-03,17:00:00,evening,Hard-Won Lessons from Deploying AI Agents in Regulated Environments,Obin AI,Financial District,False,AI / Agents / GenAI;Fintech / finance;Consumer / creative / media,product_demo_showcase;community_networking;wellness_social,"AI agents are already running inside some of the world's largest banks, asset managers, and insurers. But deployment without governance creates real exposu…",https://partiful.com/e/aIgKBhxEKiNxriSqxQhw?c=yHO9ejw_
4821,2026-06-03,17:00:00,evening,Write It Off - Happy Hour w/ Escalon x Withum x Deel,Deel,Greenwich Village,False,other,community_networking,,https://partiful.com/e/j0xoBU60bTkvoB7XSbld
5050,2026-06-03,17:00:00,evening,Finance x Product Demo Day: Turning AI Usage Into Revenue,Tabs,SoHo,False,AI / Agents / GenAI;Fintech / finance,technical_talk_workshop;product_demo_showcase,,https://partiful.com/e/Y8f9el9PvBXyyTCfZDOd
5094,2026-06-03,17:00:00,evening,Startup Storytelling,Pollen8,Midtown,False,Consumer / creative / media,other,,https://partiful.com/e/b2flvvvnTgn0MKshqnt5
5292,2026-06-03,17:00:00,evening,Sip & Ship: The Un-Hackathon,Your Next Win,Flatiron,False,other,technical_talk_workshop,,https://partiful.com/e/yd3Guyw42WWbKU5yvfOf
5439,2026-06-03,17:00:00,evening,Founder Speakeasy,Colectivo,SoHo,False,Founder fundraising / VC,other,,https://partiful.com/e/UBLRIJFbiYeOReRw1u5d
5487,2026-06-03,17:00:00,evening,Become a Superhuman: Turn Hybrid-AI into Practical Success Cases,AxonJay,Nomad,False,AI / Agents / GenAI,other,,https://partiful.com/e/deV8bgmX3XvFWYOauz7B
5833,2026-06-03,17:00:00,evening,"Shaken, stirred and strategized: Finance trivia night",PwC,Murray Hill,False,Fintech / finance,other,,
5878,2026-06-03,17:00:00,evening,The Leverage Live: How to Automate Everything,The Leverage,Flatiron,False,AI / Agents / GenAI;AI infra / devtools / cloud;Founder fundraising / VC;Consumer / creative / media,technical_talk_workshop;community_networking;fundraising_vc,"AI native startups are growing faster, pulling 2x the revenue per employee, and requiring 40% less capital to do it. In this panel and happy hour, leaders …",https://partiful.com/e/P116dOAXz8zjLzboFTQn
6173,2026-06-03,17:00:00,evening,Sequoia Leader Connect,Sequoia,Flatiron,False,other,community_networking,"Leader Connect is a way to engage with fellow leaders from the tech community in a relaxed, after-hours setting in New York City. We feature a leader who s…",https://partiful.com/e/5bTJOqJWwdhk70hBt7sx
4056,2026-06-03,17:30:00,evening,Golden Handcuffs are still Handcuffs,Alana D'Angelica Coaching & Consulting,Nomad,False,Founder fundraising / VC;Consumer / creative / media,fundraising_vc,,https://partiful.com/e/bhnr3EP9n2yG63jDrQa7
4078,2026-06-03,17:30:00,evening,The Human Advantage with Timm Chiusano,The Shop Workspace,Brooklyn,False,Climate / deeptech / hardware,other,,https://partiful.com/e/p2Pgb84MLMwnBqITLcU2
4094,2026-06-03,17:30:00,evening,Grow Everything Live: AI-Powered Engineering from Scratch,Roebling,Flatiron,False,AI / Agents / GenAI,technical_talk_workshop,,https://partiful.com/e/CeXytpOv5qBtqRKKik9O?c=BLdXQsNU
4124,2026-06-03,17:30:00,evening,After the Demo: Where Builders Meet Backers,212.VC,Flatiron,True,Founder fundraising / VC,technical_talk_workshop;product_demo_showcase;fundraising_vc,,
4540,2026-06-03,17:30:00,evening,Physical AI: A Reality Check on AI’s Next Frontier by Allsides & Nvidia,ALLSIDES,Brooklyn,False,AI / Agents / GenAI;Consumer / creative / media,other,"Artificial Intelligence is moving beyond the digital world and into the physical one. This shift, often referred to as Physical AI, is quickly becoming one…",https://partiful.com/e/wwClRE624eCpsxm0k0LP
4658,2026-06-03,17:30:00,evening,Tcsi's Headshot Happy Hour,The Cyber Security Intellects,Chelsea,False,AI infra / devtools / cloud,community_networking,,https://partiful.com/events/EnJV7INx1Avqm2pTnmG9
4725,2026-06-03,17:30:00,evening,Mobile App Leaders Dinner,WeWard,Flatiron,False,Consumer / creative / media,community_networking,"On Wednesday, June 3, WeWard will host an intimate, invite-only dinner in the heart of Flatiron, bringing together 20–25 leaders across the mobile app ecos…",https://partiful.com/e/YlpHyl2B5kM2Dv5CYqvJ
4778,2026-06-03,17:30:00,evening,The CTO Mixer: Humanizing Tech | #NYTechWeek Happy Hour,Devlane,East Village,False,other,community_networking,,https://partiful.com/e/h1hGv0PkskcagJOv5M9K
4957,2026-06-03,17:30:00,evening,The Future of Work: AI for People Operations,HiBob,Flatiron,False,AI / Agents / GenAI,other,,https://partiful.com/e/F8vJqLhP62bGK7Stqdgg
5217,2026-06-03,17:30:00,evening,When is AI Good Enough? A conversation with builders and operators,Collected Company,SoHo,False,AI / Agents / GenAI;Consumer / creative / media,technical_talk_workshop,"AI is moving out of the sandbox. As deployment becomes the new standard, organizations are facing the ultimate judgment call: ""Should we ship it?"" This tra…",https://partiful.com/e/Vt2a2B7ibq14IWj8viCe
5253,2026-06-03,17:30:00,evening,How Great Teams Win in the Age of AI,Socrates Advice,Financial District,False,AI / Agents / GenAI,other,,https://partiful.com/e/AKtjgFWAn6y37yoxfFan
5475,2026-06-03,17:30:00,evening,VC & Founder Happy Hour @  Perkins Coie,Generative IDE,Midtown,False,Founder fundraising / VC,community_networking;fundraising_vc,,https://partiful.com/e/Gj7Z2TiD5PV3Qp8OANqB
5819,2026-06-03,17:30:00,evening,She Ships: A Guided Build Session for Women with Ideas,Somarae,Midtown,False,Consumer / creative / media;Diversity / women / international,technical_talk_workshop,,https://partiful.com/e/3utTkNZhe2NKwkVBuUdU
5877,2026-06-03,17:30:00,evening,AI in the Trades - Happy Hour with ServiceTitan,ServiceTitan,Flatiron,False,AI / Agents / GenAI,community_networking,,https://partiful.com/e/Q2PgxaeZeBjXNU2XuNxh?c=BDR_T66I
5885,2026-06-03,17:30:00,evening,Cresta Networking Event,Cresta AI,Upper Manhattan,True,AI / Agents / GenAI,community_networking,,
5886,2026-06-03,17:30:00,evening,Future Families: Financing Fertility & Building Families in the Age of Tech,Partners to Parenthood,Midtown,True,Consumer / creative / media,technical_talk_workshop,,
5893,2026-06-03,17:30:00,evening,Demystifying Corporate Venture Capital,The Vertical,Midtown,False,AI infra / devtools / cloud;Founder fundraising / VC,technical_talk_workshop;fundraising_vc,,https://partiful.com/e/CFX87WLiZbQpNWETbUcP
40,2026-06-03,17:45:00,evening,From Classroom to Civic Life: How Innovative Tech Is Reshaping Education and Democracy,New Rising Ventures,Midtown,False,AI infra / devtools / cloud;Consumer / creative / media,technical_talk_workshop;product_demo_showcase,Join Retro Report and New Rising Ventures during New York Tech Week to explore how artificial intelligence and innovative technology are revolutionizing ed…,https://partiful.com/e/Mj2iNm6MWK3WnCtIHaRb
9,2026-06-03,18:00:00,evening,AI in Construction,Adaptive,Union Square,False,AI / Agents / GenAI,other,,https://partiful.com/e/ueVqfll5t78q0RIaZosC
34,2026-06-03,18:00:00,evening,AI x Cybersecurity: The Future of Trust in Tech,SweatTruth AI,Midtown,True,AI / Agents / GenAI;AI infra / devtools / cloud,other,,
94,2026-06-03,18:00:00,evening,The Future of AI in Biology - Pareto Holdings and,Pareto Holdings,SoHo,False,AI / Agents / GenAI;Founder fundraising / VC;Health / bio / wellness;Consumer / creative / media,technical_talk_workshop;fundraising_vc,"Join Pareto Holdings for an evening bringing together founders, investors, and researchers building at the intersection of biology and artificial intellige…",https://partiful.com/e/KGSXQ79cHkBiKfGSa4J4?c=EvN4eODU
96,2026-06-03,18:00:00,evening,AI Engineers: Live Podcast,Fonzi AI,Brooklyn,False,AI / Agents / GenAI,other,,https://partiful.com/e/pGL0NLh3yPk5sZHlDatO
139,2026-06-03,18:00:00,evening,Tech Week for Transatlantic Builders,Frenchfounders,Flatiron,True,Founder fundraising / VC,technical_talk_workshop,,
199,2026-06-03,18:00:00,evening,AI-assisted setups featuring Activant & Stuut,Stuut,SoHo,False,AI / Agents / GenAI;Consumer / creative / media,technical_talk_workshop;community_networking,We're hosting a happy hour for builders to discuss how they using AI to build. From claude to openclaw. We're sharing best practices and how people cook up…,https://partiful.com/e/ELpOGky1e3EphdQfLUHC
203,2026-06-03,18:00:00,evening,PHL vs NYC Founder Draft,localhost:nyc,Midtown,False,Founder fundraising / VC,other,,https://partiful.com/e/vMnZZEd9ek0rQ09zFpeE?c=vGTiWmcq
244,2026-06-03,18:00:00,evening,The New Financial Internet: NY Tech Week Mixer,Rayo Capital,SoHo,True,AI infra / devtools / cloud;Founder fundraising / VC,technical_talk_workshop;community_networking;fundraising_vc,,
3996,2026-06-03,18:00:00,evening,Modus Digital Salon: Helping Humans Choose,Modus Digital,Hudson Yards,False,Consumer / creative / media,technical_talk_workshop;community_networking,"Modus Salons are intimate, invite-only dinner events designed to gather senior leaders to network, learn about industry trends, and build community in this…",https://partiful.com/e/ph7PbMda2wCCpzRmLh1H
4071,2026-06-03,18:00:00,evening,Darkside AI Rooftop Soiree,Darkside AI,Financial District,False,AI / Agents / GenAI;AI infra / devtools / cloud;Founder fundraising / VC;Consumer / creative / media,technical_talk_workshop;fundraising_vc,"🍸An exclusive evening above the city on a private Wall Street rooftop. A discreet gathering of investors, executives and tech leaders shaping the future o…",https://partiful.com/e/7JfEW6CdsbhpkYOQkKBP
4087,2026-06-03,18:00:00,evening,New York | HappyRobot Builders Night,HappyRobot,SoHo,True,Climate / deeptech / hardware,technical_talk_workshop,,
4088,2026-06-03,18:00:00,evening,How Chiefs of Staff Build Knowledge Systems That Scale,Ask a Chief of Staff,SoHo,False,other,technical_talk_workshop,,https://partiful.com/e/2NKa5VcOrPj4F2oHrsZ9
4110,2026-06-03,18:00:00,evening,Ramp x Litquidity Padel Club,Palm & Park,Brooklyn,False,Consumer / creative / media,community_networking,​Litquidity and Ramp are joining forces to start an exclusive padel club - a series of Miami and New York based padel socials and tournaments for the indus…,https://partiful.com/e/IUjmw9zV593m1Df36kKR
4142,2026-06-03,18:00:00,evening,The Future of Hoops: Elevating The Game,Andiem,Union Square,True,other,other,,
4186,2026-06-03,18:00:00,evening,Connect on Your Level,LEVEL™,West Village,False,other,other,,https://partiful.com/e/GNv7CypZevOpJN6ol6Jk
4407,2026-06-03,18:00:00,evening,Is Software the New Fast Fashion,Alternew,Flatiron,False,Consumer / creative / media,other,,https://partiful.com/e/4iLm6df7Ix4OxkTWsJ5m
4422,2026-06-03,18:00:00,evening,Ugly Talk: The Future of Beauty Tech,Ugly Talk,SoHo,False,Health / bio / wellness,other,,https://partiful.com/e/68VP2zOWWMpKd3gZsojI
4466,2026-06-03,18:00:00,evening,From Legislation to Action: Shaping the Future of Privacy in New York,Woodhull Freedom Foundation,Greenwich Village,False,AI infra / devtools / cloud;Consumer / creative / media,technical_talk_workshop;product_demo_showcase,Privacy isn’t abstract for LGBTQ+ people. It’s often the difference between safety and exposure. In a world where our lives are increasingly lived online a…,https://partiful.com/e/ndxAl17PlEmXU25KpLzy?c=y7xdvBtU
4481,2026-06-03,18:00:00,evening,Secret Garden Party,Entre,Lower East Side,False,Consumer / creative / media,community_networking,,https://partiful.com/e/YtPpBkhAuVR9Wsm6UfoE
4489,2026-06-03,18:00:00,evening,The Ultimate Marketing Trivia Night!,Wistia,West Village,False,AI infra / devtools / cloud;GTM / marketing / creator;Consumer / creative / media,community_networking,Get ready to flex your brand brilliance and data-driven wit at the most high-stakes happy hour of Boston Tech Week. Join a room full of the city’s sharpest…,https://partiful.com/e/8SXCfTdKIADQfNVRTvDH
4539,2026-06-03,18:00:00,evening,AI Game Dev Mini- Hackathon (by Vevey!),Vevey,Flatiron,False,AI / Agents / GenAI,technical_talk_workshop,"Come build your own video game from scratch in just one afternoon! Using Vevey's AI-powered platform, you will go from idea to fully playable game in a few…",https://partiful.com/e/mlTKGO4ougVZjKKQNAJk
